{
  "telegram_bot_token": "YOUR_TELEGRAM_BOT_TOKEN_HERE",
  "telegram_chat_id": 0,
  "port": "8000",
  "gateway_api_key": "dev-secret-key",
  "webhook_secret": "dev-webhook-secret",
  "log_level": "DEBUG",
  "routes": {
    "receiver-a": "http://receiver-a:8081/callback",
    "receiver-b": "http://receiver-b:8082/callback"
  },
  "rate_limits": {
    "global_per_second": 30,
    "chat_per_second": 1
  }
}
